{
    "status": "OK",
    "copyright": "Copyright (c) 2025 The New York Times Company.  All Rights Reserved.",
    "num_results": 36793,
    "results": [
        {
            "title": "2034",
            "description": "The global balance of power shifts after new cyberweaponry lowers the defenses of U.S. planes and ships.",
            "contributor": "by Elliot Ackerman and Adm. James Stavridis",
            "author": "Elliot Ackerman and Adm. James Stavridis",
            "contributor_note": "",
            "price": "0.00",
            "age_group": "",
            "publisher": "Penguin Press",
            "isbns": [
                {
                    "isbn10": "1984881256",
                    "isbn13": "9781984881250"
                },
                {
                    "isbn10": "1984881264",
                    "isbn13": "9781984881267"
                }
            ],
            "ranks_history": [],
            "reviews": [
                {
                    "book_review_link": "",
                    "first_chapter_link": "",
                    "sunday_review_link": "",
                    "article_chapter_link": ""
                }
            ]
        },
        {
            "title": "206 BONES",
            "description": "Temperance Brennan is accused of mishandling an autopsy.",
            "contributor": "by Kathy Reichs",
            "author": "Kathy Reichs",
            "contributor_note": "",
            "price": "26.99",
            "age_group": "",
            "publisher": "Scribner",
            "isbns": [
                {
                    "isbn10": "141652567X",
                    "isbn13": "9781416525677"
                }
            ],
            "ranks_history": [],
            "reviews": [
                {
                    "book_review_link": "",
                    "first_chapter_link": "",
                    "sunday_review_link": "",
                    "article_chapter_link": ""
                }
            ]
        },
        {
            "title": "20:21 Vision: Twentieth-Century Lessons for the Twenty-first Century",
            "description": null,
            "contributor": null,
            "author": "Bill Emmott",
            "contributor_note": null,
            "price": "0.00",
            "age_group": null,
            "publisher": null,
            "isbns": [
                {
                    "isbn10": "0374279659",
                    "isbn13": "9780374279653"
                }
            ],
            "ranks_history": [],
            "reviews": [
                {
                    "book_review_link": "",
                    "first_chapter_link": null,
                    "sunday_review_link": "https:\/\/www.nytimes.com\/2003\/02\/02\/books\/2-1-2-cheers-for-capitalism.html",
                    "article_chapter_link": null
                }
            ]
        },
        {
            "title": "20TH CENTURY BOYS, VOL. 17",
            "description": "From the publisher: \"Darkness covers the earth, and the world is under the control of evil.\" Who will rise up to fight for good?",
            "contributor": "by Naoki Urasawa",
            "author": "Naoki Urasawa",
            "contributor_note": "",
            "price": "12.99",
            "age_group": "",
            "publisher": "VIZ Media",
            "isbns": [
                {
                    "isbn10": "1421535351",
                    "isbn13": "9781421535357"
                }
            ],
            "ranks_history": [],
            "reviews": [
                {
                    "book_review_link": "",
                    "first_chapter_link": "",
                    "sunday_review_link": "",
                    "article_chapter_link": ""
                }
            ]
        },
        {
            "title": "20TH CENTURY BOYS, VOL. 20",
            "description": "From the publisher: \"Darkness covers the earth, and the world is under the control of evil.\" Who will rise up to fight for good?",
            "contributor": "by Naoki Urasawa",
            "author": "Naoki Urasawa",
            "contributor_note": "",
            "price": "12.99",
            "age_group": "",
            "publisher": "VIZ Media",
            "isbns": [
                {
                    "isbn10": "1421535386",
                    "isbn13": "9781421535388"
                }
            ],
            "ranks_history": [],
            "reviews": [
                {
                    "book_review_link": "",
                    "first_chapter_link": "",
                    "sunday_review_link": "",
                    "article_chapter_link": ""
                }
            ]
        },
        {
            "title": "20TH CENTURY BOYS, VOL. 21",
            "description": "In this penultimate volume of the apocalyptic series, The Friend is poised to carry out his plan for destruction and only the boys can stop him.",
            "contributor": "by Naoki Urasawa",
            "author": "Naoki Urasawa",
            "contributor_note": "",
            "price": "12.99",
            "age_group": "",
            "publisher": "VIZ Media",
            "isbns": [
                {
                    "isbn10": "1421535394",
                    "isbn13": "9781421535395"
                }
            ],
            "ranks_history": [],
            "reviews": [
                {
                    "book_review_link": "",
                    "first_chapter_link": "",
                    "sunday_review_link": "",
                    "article_chapter_link": ""
                }
            ]
        },
        {
            "title": "21 LESSONS FOR THE 21ST CENTURY",
            "description": "Technological, political and social issues in the modern era, and the choices individuals might consider in facing them.",
            "contributor": "by Yuval Noah Harari",
            "author": "Yuval Noah Harari",
            "contributor_note": "",
            "price": "0.00",
            "age_group": "",
            "publisher": "Random House",
            "isbns": [
                {
                    "isbn10": "0525512179",
                    "isbn13": "9780525512172"
                },
                {
                    "isbn10": "0525512187",
                    "isbn13": "9780525512189"
                },
                {
                    "isbn10": "0525639853",
                    "isbn13": "9780525639855"
                },
                {
                    "isbn10": "0525512195",
                    "isbn13": "9780525512196"
                }
            ],
            "ranks_history": [],
            "reviews": [
                {
                    "book_review_link": "https:\/\/www.nytimes.com\/2018\/09\/04\/books\/review\/21-lessons-for-the-21st-century-yuval-noah-harari.html",
                    "first_chapter_link": "",
                    "sunday_review_link": "",
                    "article_chapter_link": ""
                }
            ]
        },
        {
            "title": "21 NIGHTS",
            "description": "Poetry, lyrics, a CD and a photographic essay evoke Prince\u2019s concerts in London in 2007.",
            "contributor": "by Prince and Randee St. Nicholas",
            "author": "Prince and Randee St Nicholas",
            "contributor_note": "",
            "price": "0.00",
            "age_group": "",
            "publisher": "Atria",
            "isbns": [],
            "ranks_history": [],
            "reviews": [
                {
                    "book_review_link": "",
                    "first_chapter_link": "",
                    "sunday_review_link": "",
                    "article_chapter_link": ""
                }
            ]
        },
        {
            "title": "21-DAY TUMMY",
            "description": "A diet aimed at shrinking belly fat.",
            "contributor": "by Liz Vaccariello with Kate Scarlata",
            "author": "Liz Vaccariello with Kate Scarlata",
            "contributor_note": "",
            "price": "0.00",
            "age_group": "",
            "publisher": "Reader's Digest",
            "isbns": [
                {
                    "isbn10": "1621451119",
                    "isbn13": "9781621451112"
                }
            ],
            "ranks_history": [],
            "reviews": [
                {
                    "book_review_link": "",
                    "first_chapter_link": "",
                    "sunday_review_link": "",
                    "article_chapter_link": ""
                }
            ]
        },
        {
            "title": "21-DAY WEIGHT LOSS KICKSTART",
            "description": "A plant-based way to slim down and boost health.",
            "contributor": "by Neal D. Barnard",
            "author": "Neal D Barnard",
            "contributor_note": "",
            "price": "25.99",
            "age_group": "",
            "publisher": "Grand Central Life & Style",
            "isbns": [
                {
                    "isbn10": "0446583812",
                    "isbn13": "9780446583817"
                }
            ],
            "ranks_history": [],
            "reviews": [
                {
                    "book_review_link": "",
                    "first_chapter_link": "",
                    "sunday_review_link": "",
                    "article_chapter_link": ""
                }
            ]
        },
        {
            "title": "2182 kHz",
            "description": null,
            "contributor": null,
            "author": "David Masiel",
            "contributor_note": null,
            "price": "0.00",
            "age_group": null,
            "publisher": null,
            "isbns": [
                {
                    "isbn10": "0375506063",
                    "isbn13": "9780375506062"
                }
            ],
            "ranks_history": [],
            "reviews": [
                {